{
  "$schema": "https://json-schema.org/draft/2020-12/schema",
  "$id": "https://dc-farmer.example/schema/team.json",
  "title": "Team",
  "type": "object",
  "required": ["id", "name", "discipline"],
  "properties": {
    "id": { "type": "string", "pattern": "^[a-z0-9-]+$" },
    "name": { "type": "string", "minLength": 2, "maxLength": 80 },
    "discipline": { "type": "string", "enum": ["edarts", "steeldarts"] },
    "division": { "type": "string", "minLength": 1, "maxLength": 60 },
    "members": {
      "type": "array",
      "items": { "type": "string", "pattern": "^[a-z0-9-]+$" },
      "uniqueItems": true
    }
  },
  "additionalProperties": false
}
